{
  "message_type": "action.authorized",
  "protocol_version": "0.1.0",
  "request_id": "req-0001",
  "task_id": "task-0001",
  "span_id": "span-0001",
  "device_id": "device-0001",
  "tool": "phone.current_app",
  "parameters": {},
  "state_precondition": null,
  "verification": null,
  "idempotency_key": "idem-0001",
  "attempt": 1,
  "requested_at": "2026-08-30T10:00:00Z",
  "deadline": "2026-08-30T10:00:30Z",
  "action_digest": "sha256:8a915c4cd0115c97796ead9adfbc69a45310d3036992213b14f06c0d1eed8069",
  "effective_target": null,
  "effective_risk": "L0",
  "policy_decision_id": "decision-0001",
  "execution_authorization": "abcdefghijklmnopqrstuv",
  "authorization_algorithm": "ES256",
  "authorization_key_id": "key-0001",
  "broker_id": "broker-0001",
  "session_id": "session-0001",
  "sequence": 1,
  "nonce": "abcdefghijklmnopqrstuv",
  "issued_at": "2026-08-30T10:00:00Z",
  "expires_at": "2026-08-30T10:00:20Z"
}
